{
    "table_name": "My Table",
    "PK": [["PK_COL_1", "number"],["PK_COL_2", "number"],["PK_COL_3", "string"] ],
    "Type 1": [["T1_1", "number"],["T1_2", "number"],["T1_3", "string"] ],
    "Type 2": [["T2_1", "number"],["T2_2", "number"],["T2_3", "string"] ],
    "Type 3": [["T3_1", "number"],["T3_2", "number"],["T3_3", "string"] ] 
}